{
  "$schema": "https://decapod.dev/schemas/research-claims-ledger-1.0.0.schema.json",
  "schema_version": "1.0.0",
  "kind": "research_claims_ledger",
  "ledger_id": "project-research-claims",
  "title": "Project Falsifiable Research Claims",
  "purpose": "Provide a schema-valid starting point for repository-owned, evidence-bounded claims.",
  "authority": {"owner":"Project maintainers","source_issue":"https://github.com/DecapodLabs/decapod/issues/1025","status":"active","created_at":"2026-07-25","updated_at":"2026-07-25","change_policy":"Replace or extend this template through issue-scoped review while preserving baseline, condition, failure modes, measurements, and proof references."},
  "scope": {"product":"project","repository":"repository-owner/repository-name","in_scope":["repository capabilities with explicit evidence"],"out_of_scope":["unmeasured production performance","security guarantees without repository evidence"]},
  "methodology": {"falsifiability_standard":"Every claim names a baseline, an observable condition, a failure mode, measurable evidence, and a proof gate.","evidence_statuses":["not_started","instrumented","partial","supported","falsified","superseded"],"measurement_rules":[{"id":"proof-reference","name":"Proof reference","requirement":"A passing claim must identify the artifact or command that supports it.","unit":"proof_reference","evidence_source":"repository-native governance artifacts"}]},
  "claims": [{
    "id":"replace-template-claim","sequence":1,"title":"Repository claims require explicit evidence","statement":"A repository capability should not be treated as established until its baseline, observable condition, failure mode, measurements, and proof gate are recorded.","why_it_matters":"A structured claim prevents completion language from being mistaken for measured evidence.",
    "baseline":{"description":"Review a repository capability without a claims ledger.","population":"Repository capabilities under review.","unit_of_analysis":"repository_capability","protocol":["Record the capability without a structured claim.","Attempt to identify the evidence supporting the capability."],"controls":["Use the same repository capability in both conditions."],"confounders":["Reviewer interpretation may vary."]},
    "decapod_condition":{"description":"Review the same capability with this claims ledger and its referenced proof artifacts.","population":"Repository capabilities under review.","unit_of_analysis":"repository_capability","protocol":["Record baseline and Decapod conditions.","Record observable failure modes and proof references.","Run the required validation command before promotion."],"controls":["Use the same repository capability and observation window."],"confounders":["Missing or stale proof artifacts."]},
    "failure_modes":[{"id":"missing-evidence","description":"The claim is recorded without a resolvable proof artifact.","observable_signal":"The proof gate references a missing or invalid file.","severity":"high","falsifier":"Validation reports a missing or invalid required proof artifact."}],
    "measurements":[{"id":"proof-gate-pass","name":"Proof gate result","definition":"Whether the required validation command exits successfully.","unit":"boolean","scale":"nominal","aggregation":"qualitative","collection_method":"Run the command named by the proof gate.","comparator":"Required validation result equals pass.","success_direction":"match","threshold":null}],
    "proof_gate":{"id":"replace-template-proof","required_artifacts":[{"path":".decapod/governance/claims.json","kind":"schema","required":true,"integrity":"schema","relationship":"contains the repository-owned claim and its evidence contract"}],"required_commands":[{"id":"governed-validation","command":"decapod validate --format json","expected_exit_code":0,"bounded_seconds":120,"evidence_artifact":".decapod/governance/validation.json"}],"acceptance_criteria":["Replace this template claim with a project-specific, issue-reviewed claim.","Keep all proof references resolvable and evidence status bounded by observation."],"failure_behavior":"Keep the claim unsupported and repair or remove the invalid proof reference before publication."},
    "open_questions":[{"id":"project-specific-claim","question":"Which project capability should replace this template claim first?","decision_impact":"Determines the first repository-specific research claim and its required proof.","owner":"Project maintainers","status":"open"}],
    "evidence":{"status":"not_started","summary":"This is a generated starting point and has not yet been evaluated as a project-specific claim.","sources":[{"id":"claims-template-issue","kind":"issue","ref":"https://github.com/DecapodLabs/decapod/issues/1025","description":"Issue defining the deterministic claims-ledger template and repair path.","trust":"human-authored"}],"observations":[{"id":"template-created","observed_at":"2026-07-25","result":"A schema-valid claims ledger template is available for replacement by project maintainers.","source_refs":["claims-template-issue"]}],"last_evaluated_at":"2026-07-25"},
    "implementation_links":[{"surface":"claims ledger template","path":".decapod/governance/claims.json","symbol":"replace-template-claim","relationship":"documents"},{"surface":"governed validation","path":".decapod/governance/validation.json","symbol":"validation receipt","relationship":"proves"}],
    "non_guarantees":["The generated template is not evidence that the project capability has been measured.","The template does not replace human review or issue-scoped claim maintenance."]
  }],
  "governance":{"required_claim_fields":["id","sequence","title","statement","why_it_matters","baseline","decapod_condition","failure_modes","measurements","proof_gate","open_questions","evidence","implementation_links","non_guarantees"],"review_policy":"Reviewers must check that every claim remains falsifiable, evidence status is bounded by observed evidence, proof references resolve, and schema compatibility is preserved.","new_capability_rule":"Every new capability must map to an existing claim or introduce a new falsifiable claim before it is treated as research-relevant.","change_control":{"requires_issue":true,"requires_validation":true,"requires_human_review":true}}
}
